<?xml version="1.0" encoding="UTF-8"?>
<!DOCTYPE section SYSTEM "../documentation.dtd">
<section>
  <title>Configuration</title>

  <para>The <class>NakedObjectConfiguration</class> interface provides the
  rest of the framework with a central place to access all configuration
  properties. Each property is accessed by a fully qualified name and
  type.</para>

  <subheading>Installling this Component</subheading>

  <para>A configuration is installed by assigning an instance of
  <class>org.nakedobjects.utility.NakedObjectConfiguration</class> to the NOF
  repository. How the properties are loaded is then up to the
  implementation.</para>

  <program-listing>NakedObjects.setConfiguration(new Coniguration());</program-listing>

  <subheading>Using this Component</subheading>

  <para>The configuration component can be retrieved from
  <class>org.nakedobjects.NakedObjects</class> using the
  <method>getConfiguration</method> method.</para>

  <minorheading>Accessing properties</minorheading>

  <para>The configuration allows you to add properties to it, check it
  contains a specific property and get specific properties by name. The get
  methods return specific type such as boolean, integer, font, color and
  strings.</para>

  <minorheading>Programmatically configuring options</minorheading>

  <para>All of the configuration options can be set programmatically, which
  can be convienient when developing and running the exploration code,
  avoiding the need to create a separate configuration file. To add a
  key-value pair simply call the <method>add</method> method on the
  configuration object with a key <class>String</class> and a value
  <class>String</class>. To change the title style, for example, add the
  following to the <method>main</method> method:</para>

  <program-listing>NakedObjects.getConfiuration.add("nakedobjects.skylark.font.title", "Serif-bold-18");</program-listing>

  <comment>Add the javadoc methods</comment>
</section>